{
  "identity": {"sessionId": "770e8400-e29b-41d4-a716-446655440022", "schemaVersion": 1},
  "model": {"provider": "gemini", "model": "gemini-1.5-pro"},
  "timestamp": {"start": 1680000000000, "end": 1680000030000},
  "source": {"filePath": "/proj/raw.jsonl", "format": "jsonl"},
  "project": {"hash": "a1b2c3d4e5f6a1b2c3d4e5f6a1b2c3d4e5f6a1b2c3d4e5f6a1b2c3d4e5f6a1b2", "name": "raw-project"}
}
